ID,Phase,Title,Section_Path,Claim_ID,Evidence_Type,Experiment_ID,Result_Status,Description,Source_Policy,Target_Citations,Visualization,Acceptance,Status,Verified_Citations,Depends_On,Must_Verify,Notes
R1,Research,Research snapshot,N/A,N/A,n/a,N/A,n/a,Collect the initial spine papers and lock the closest baselines,N/A,0,N/A,Snapshot identifies scope; nearest prior work; and evidence needs,DONE,0,N/A,yes,Duplicate/split/insert rows as needed; re-validate after edits
R2,Research,Baseline shortlist & competitive landscape,N/A,N/A,citation,N/A,n/a,Systematically identify 10-20 candidate baselines across 3 categories (direct_competitor / foundational / ablation_anchor). Record each in notes/design/baselines.csv with paper title; code URL; datasets; strengths; weaknesses. Select 4-8 for final comparison.,N/A,0,N/A,baselines.csv has >=10 candidates with >=4 selected; covers all 3 categories,DONE,0,R1,yes,See references/experiment-design.md Section 1
R3,Research,Method positioning notes,N/A,N/A,citation,N/A,n/a,Write bullet-only positioning: what we change vs prior work and what we do not claim,N/A,0,N/A,Positioning notes contain at least 3 reviewer objections with responses,DONE,0,R1,yes,
R4,Research,Pipeline component inventory,N/A,N/A,n/a,N/A,n/a,Design the method pipeline: identify all components; define input/output interfaces; mark novel vs standard components; specify ablation replacements. Record in notes/design/method-components.csv.,N/A,0,Pipeline architecture diagram,method-components.csv has >=3 components with is_novel and replaceable_by filled,DONE,0,R2;R3,yes,See references/experiment-design.md Section 3
E0,Experiment,Baseline identification & selection,N/A,C1,citation,EXP-0,planned,Verify selected baselines from R2: confirm code availability; reproduce or collect reported results on target datasets; flag any baselines that cannot be fairly compared. Update baselines.csv selected column.,N/A,0,N/A,All selected baselines have confirmed evaluation path (public code or paper-reported results),DONE,0,R2,yes,Evaluation path confirmed for all selected baselines; case-specific reproduction awaits dataset finalization
E1,Experiment,Experiment matrix (main comparison),Results,C1,experiment,EXP-1,planned,Design the main comparison matrix: baselines x datasets x metrics. Ensure fair comparison (same splits; same preprocessing; same evaluation protocol). Record full matrix in notes/design/experiment-matrix.csv rows with type=main_comparison.,N/A,0,Main results table,experiment-matrix.csv has >=1 main_comparison row per selected baseline per dataset,DONE,0,E0;R4,yes,Matrix recorded in notes/design/experiment-matrix.csv (dataset placeholders until case study fixed)
E2,Experiment,Ablation matrix,Results > Ablation Studies,C1,experiment,EXP-2,planned,Design ablation experiments from method-components.csv: for each high-priority component define removal/degradation strategy and expected impact. Record in experiment-matrix.csv rows with type=ablation. Minimum 4 ablation factors.,N/A,0,Ablation table,experiment-matrix.csv has >=4 ablation rows; each links to a component_id,DONE,0,E1;R4,yes,Recorded in notes/design/experiment-matrix.csv with component_id links
E3,Experiment,Robustness/error analysis plan,Results > Error Analysis / Robustness,C1,experiment,EXP-3,planned,Define robustness checks (noise; distribution shift; domain transfer) and error analysis (failure case categories; sampling protocol). Record in experiment-matrix.csv rows with type=robustness.,N/A,0,Robustness figure,experiment-matrix.csv has >=2 robustness rows with corruption severities defined,DONE,0,E1,yes,Recorded in notes/design/experiment-matrix.csv with explicit severity_levels
E4,Experiment,Efficiency/scalability analysis,Results > Efficiency,C1,experiment,EXP-4,planned,Compare computational cost: parameter count (M); FLOPs (G); inference latency (ms) against selected baselines. Record in experiment-matrix.csv rows with type=efficiency.,N/A,0,Efficiency comparison table,experiment-matrix.csv has >=1 efficiency row with params/FLOPs/latency columns filled,DONE,0,E0,no,Recorded in notes/design/experiment-matrix.csv (metrics planned; values pending experiments)
E5,Experiment,Write experiment code,N/A,C1,experiment,EXP-CODE,verified,Write training and evaluation scripts based on method-components.csv and experiment-matrix.csv. Include: model implementation; training loop; evaluation metrics computation; data loading. Code must be runnable with the configured runtime.,N/A,0,N/A,Training script and evaluation script exist; pass syntax check (python -m py_compile); use experiment-matrix metrics,DONE,0,E1;R4,yes,Code structure should follow method-components.csv pipeline
E6,Experiment,Write experiment runner and configs,N/A,C1,experiment,EXP-RUNNER,verified,Create run_all.py (orchestrates all experiment types from experiment-matrix.csv) and YAML config files under experiments/configs/. Runner must accept --config flag and export results to paper/results/.,N/A,0,N/A,run_all.py exists; configs/ has at least one .yaml; run_all.py --help exits 0,DONE,0,E5,yes,Must read runtime config from paper.config.yaml
E7,Experiment,Write experiments README,N/A,C1,experiment,EXP-README,verified,Create experiments/README.md with: environment setup; dependency installation; how to run each experiment type; config file explanation; expected output paths; how to invoke results-backfill after completion.,N/A,0,N/A,README.md exists in experiments/; covers setup + run + output sections,DONE,0,E6,yes,Reference paper.config.yaml runtime section
E8,Experiment,Run main comparison experiments,Results,C1,experiment,EXP-MAIN,verified,Execute main comparison experiments per experiment-matrix.csv rows with type=main_comparison. Export results to paper/results/.,N/A,0,N/A,main_results.csv exists and matches experiment-matrix main_comparison rows,DONE,0,E6;E1,yes,Runnable code or manual results import required
E9,Experiment,Run ablation experiments,Results > Ablation Studies,C1,experiment,EXP-ABL,verified,Execute ablation experiments per experiment-matrix.csv rows with type=ablation. Export results.,N/A,0,Ablation results table,Ablation results CSV exists; covers all high-priority ablation rows in experiment-matrix,DONE,0,E6;E2;E8,yes,Skip if user cannot run; mark Result_Status=planned
E10,Experiment,Run robustness experiments,Results > Robustness,C2,experiment,EXP-ROB,verified,Execute robustness experiments per experiment-matrix.csv rows with type=robustness. Export results.,N/A,0,Robustness figure,Robustness results exist; cover all robustness rows in experiment-matrix,DONE,0,E6;E3;E8,yes,Skip if user cannot run; mark Result_Status=planned
E11,Experiment,Export verified results to LaTeX,Results,C1,experiment,EXP-EXPORT,verified,Convert all verified experiment results to LaTeX input tables/figures under paper/results/,N/A,0,N/A,All verified results have corresponding .tex input files; no -- placeholders in tables,DONE,0,E8,yes,
W1,Writing,Introduction,Introduction,C1,mixed,N/A,n/a,Draft the introduction and contribution framing,core,8,Contribution teaser figure,Section drafted with citations and bounded claims,DONE,16,R3,yes,Keep claim language aligned with evidence matrix
W2,Writing,Related work,Related Work,C2,citation,N/A,n/a,Draft a minimal (non-survey) related work that distinguishes this paper,standard,12,Taxonomy mini-table,Section distinguishes at least 3 closest lines of work with citations,DONE,19,R2,yes,
W3,Writing,Method,Method,C1,mixed,N/A,n/a,Draft the method section based on notes/design/method-components.csv: describe each component; justify design choices; include pipeline diagram,standard,6,Pipeline diagram,Method includes clear inputs/outputs and design rationale for novel components,DONE,10,R4,yes,Reference method-components.csv for component details
W4,Writing,Experimental setup,Experimental Setup,C1,mixed,N/A,n/a,Draft experimental setup based on notes/design/experiment-matrix.csv and baselines.csv: datasets; baselines; metrics; implementation details; reproducibility info,standard,10,Setup summary table,Setup includes reproducibility details and exact protocol,DONE,16,E1,yes,
W5,Writing,Results (placeholder-safe),Results,C1,experiment,EXP-1,placeholder,Draft results section with explicit hypothesis-safe placeholder language. Do not include numbers or significance claims unless verified.,standard,8,Main results table,All result statements are hypothesis-safe; all tables/figures use -- or placeholders until verified,DONE,11,W4;E2;E3;E4,yes,Do not invent numbers
W6,Writing,Limitations & ethics,Limitations,C4,citation,N/A,n/a,Draft limitations focusing on method constraints; failure modes; evidence gaps,standard,4,N/A,Limitations include at least 3 concrete limitations tied to evidence status,DONE,7,W5,no,
W7,Writing,Conclusion,Conclusion,C1,n/a,N/A,placeholder,Draft conclusion using hypothesis-safe language when results are not yet verified; upgrade to factual claims only after backfill.,standard,0,N/A,Conclusion contains no fabricated outcomes; uses (hypothesis)/[Pending] tags until verified,DONE,0,W6,no,
W0,Writing,Abstract,Abstract,C1,n/a,N/A,placeholder,Draft abstract: problem; method; setting; key outcome only if verified; implication. Must be self-contained. See references/abstract-conclusion-guide.md.,core,0,N/A,Abstract is substantive (not a stub); contains specific verified numbers if available; <=250 words,DONE,0,W5;W7,yes,Write only after Results and Conclusion are DONE
V1,Visual,System overview figure,Introduction,C1,figure,N/A,n/a,Generate TikZ system overview showing problem setting and where the method fits. Derive from method-components.csv and domain context. See references/figure-generation-guide.md.,N/A,0,System overview / teaser TikZ figure,TikZ figure compiles; is referenced in Introduction; shows problem + method modules,DONE,0,W1;R4,no,Pattern: system-overview from figure-generation-guide.md
V2,Visual,Method architecture diagram,Method > Approach Overview,C1,figure,N/A,n/a,Generate TikZ method architecture diagram from method-components.csv. Novel components highlighted. See references/figure-generation-guide.md.,N/A,0,Method pipeline / architecture TikZ diagram,TikZ figure compiles; shows all pipeline components; novel ones visually distinguished,DONE,0,W3;R4,no,Pattern: method-architecture from figure-generation-guide.md
V3,Visual,Case-study inflow time series,Experimental Setup,C1,figure,N/A,n/a,Generate a publication-quality figure showing daily inflow time series for the three reservoirs with train/tune/test split boundaries.,N/A,0,inflow_timeseries_splits.pdf,Figure compiles; is referenced in Experimental Setup; shows chronological splits clearly,DONE,0,W4,no,Generated via experiments/render_figures.py from ResOpsUS2 time series
V4,Visual,Forecast skill per reservoir,Results > Forecast Skill,C2,figure,N/A,verified,Generate a figure that breaks down CRPS/RMSE by reservoir for key forecast baselines and the rolling AR(p) forecaster.,N/A,0,forecast_skill_by_dam.pdf,Figure compiles; is referenced in Results; supports bounded per-reservoir discussion,DONE,0,W5,no,Generated from paper/results/forecast_results_per_dam.json
V5,Visual,Operational value per reservoir,Results > Operational Main Results,C1,figure,N/A,verified,Generate a figure showing objective change (relative to baseline) and violation rate per reservoir across operational pipelines.,N/A,0,ops_by_dam.pdf,Figure compiles; is referenced in Results; supports heterogeneity discussion and violation concentration claim,DONE,0,W5,no,Generated from paper/results/main_results_per_dam.json
V6,Visual,Robustness plot: inflow scaling,Results > Error Analysis / Robustness,C4,figure,N/A,verified,Generate a plot of objective change (%) and violation-rate change (pp) under multiplicative inflow scaling (relative to baseline) for key methods.,N/A,0,robustness_inflow_scale.pdf,Figure compiles; is referenced in Robustness; axes and sign conventions match caption; derived from robustness_results.csv,DONE,0,W5,no,Generated from paper/results/robustness_results.csv
V7,Visual,Robustness heatmap: sparse/delayed obs,Results > Error Analysis / Robustness,C4,figure,N/A,verified,Generate a heatmap figure summarizing objective change and violation rate under sparse/delayed observations for rolling calibration.,N/A,0,robustness_obs_sparse_delay.pdf,Figure compiles; is referenced in Robustness; clearly shows sensitivity surface,DONE,0,W5,no,Generated from paper/results/robustness_results.csv
V8,Visual,Runtime breakdown figure,Results > Efficiency,C4,figure,N/A,verified,Generate a runtime breakdown figure separating rolling-calibration time and dispatch time per cycle.,N/A,0,runtime_breakdown.pdf,Figure compiles; is referenced in Efficiency; consistent with efficiency table,DONE,0,W5,no,Generated from paper/results/efficiency_results.csv
V9,Visual,Ablation summary figure,Results > Ablation Studies,C3,figure,N/A,verified,Generate a compact ablation summary figure reporting objective change (%) and violation-rate change (pp) relative to the full method.,N/A,0,ablation_summary.pdf,Figure compiles; is referenced in Ablation Studies; labels do not overlap; derived from ablation_results.csv,DONE,0,W9,no,Generated from paper/results/ablation_results.csv via experiments/render_figures.py
V10,Visual,Forecast calibration tradeoff,Results > Forecast Skill,C2,figure,N/A,verified,Generate a figure showing CRPS versus nominal 80% coverage (calibration vs sharpness) for key forecasters broken down by reservoir.,N/A,0,forecast_calibration_tradeoff.pdf,Figure compiles; is referenced in Forecast Skill; supports bounded calibration discussion,DONE,0,W9,no,Generated from paper/results/forecast_results_per_dam.json via experiments/render_figures.py
V11,Visual,Compute--value tradeoff,Results > Efficiency,C4,figure,N/A,verified,Generate a compute--value tradeoff figure plotting runtime per cycle (ms) versus objective change (%) relative to the static baseline aggregated across reservoirs.,N/A,0,runtime_value_tradeoff.pdf,Figure compiles; is referenced in Efficiency; derived from main_results_per_dam.json and main_results_timing_per_dam.json,DONE,0,W9,no,Generated via experiments/render_figures.py; uses per-dam runtime and objective deltas
W8,Writing,Method details (equations),Method,C1,mixed,N/A,n/a,Expand the Method section with an explicit formulation of rolling calibration (RLS) probabilistic scenario generation MPC objective/constraints and feedback inflation.,standard,6,N/A,Method is more detailed and reproducible; no fabricated claims,DONE,10,W3,no,Added equations aligned with implementation in experiments/sim/rollout.py
W9,Writing,Results expanded with per-reservoir plots,Results,C1,experiment,N/A,verified,Expand Results narrative to discuss heterogeneity across reservoirs and tie bounded claims to the new figures.,standard,8,N/A,Results discuss per-reservoir breakdown and robustness with figure support; no new unverified claims,DONE,11,W5;V4;V5;V6;V7;V8,no,Added figure references and heterogeneous interpretation
W10,Writing,Discussion,Discussion,C1,mixed,N/A,n/a,Add a Discussion section interpreting forecast-skill vs operational-value results; role of uncertainty propagation and feedback; and feasibility implications.,standard,1,N/A,Discussion is grounded in verified results/figures and existing citations; no fabricated claims,DONE,1,W9,no,Added Discussion section with bounded statements and figure references
W11,Writing,Integrate calibration/runtime tradeoff figures,Results,C2,mixed,N/A,verified,Integrate the calibration tradeoff and compute--value tradeoff figures into the Results narrative with bounded interpretation aligned to the reported summary metrics.,standard,1,N/A,New figures are introduced and interpreted without changing reported numbers; no new unverified claims,DONE,11,W9;V10;V11,no,Added references to Fig. forecast_calibration_tradeoff and Fig. runtime_value_tradeoff
RF1,Refinement,Rhythm refinement,N/A,N/A,n/a,N/A,n/a,Apply latex-rhythm-refiner after all writing and visual issues are DONE,N/A,0,N/A,All sections refined and citations preserved,DONE,0,W0;W1;W2;W3;W4;W5;W6;W7;W8;W9;W10;W11;V1;V2;V3;V4;V5;V6;V7;V8;V9;V10;V11,no,Applied latex-rhythm-refiner pass to paper/main.tex after adding expanded method/results and new figures
Q1,QA,Citation verification,N/A,N/A,n/a,N/A,n/a,Verify citations; source policy; compilation status,N/A,0,N/A,All citation audits pass and BibTeX lint is clean,DONE,0,RF1,yes,Passed: compile_paper.py --check-warnings --fail-on-warnings; citation_policy lint-bib audit-bib verify-bib audit-tex
